name,brand,sku,category_hierarchy,url,price,unit_pack_size,availability,description,specifications,image_urls,alternative_products
Safco CleanCare™,,,,https://www.safcodental.com/product/safco-cleancare-trade-prophy-paste,,,,,{},https://www.safcodental.com/media/catalog/product/l/b/lbzah.jpg?optimize=medium&fit=bounds&height=360&width=360&canvas=360:360,
R.T.R. Membrane,Safco Dental,PFWRX,Sutures & surgical products,https://www.safcodental.com/product/r-t-r-membrane,$108.99,,In Stock,"Biocompatible Type I bovine Achilles tendon collagen. The absorbable, implantable material creates a barrier to protect PDL development from fast growing tissues. Supports wound stabilization and allows essential nutrients to pass through.

Indicated for GTR procedures.
Absorbable within 4-8 weeks.
Appears white in the dry state; translucent and non-slippery when wet.
Cut to size and shape.
",{},"https://www.safcodental.com/media/catalog/product/p/f/pfwrx.jpg?width=265&height=265&canvas=265,265&optimize=medium&fit=bounds",
Myco Medical&nbsp;GLASSVAN&reg; Scalpel Blades,Safco Dental,PFLWR,Sutures & surgical products,https://www.safcodental.com/product/myco-medical-nbsp-glassvan-reg-scalpel-blades,$24.99,,In Stock,"GLASSVAN&reg; Surgical Blades have been trusted by users around the world for more than 25 years.

Automated grinding and proprietary polishing process ensure consistent, clean, and sharp cutting edges
Produced from high quality Swiss carbon steel
Two VCI strips ensure product and packaging integrity and reduce risk of blade piercing the foil
Manufactured in FDA-inspected facilities and conform to ISO-7740 and ISO-13485

Carbon steel and stainless-steel blades are available sterile in sizes 10-25, with select sizes also available non-sterile.",{},"https://www.safcodental.com/media/catalog/product/p/f/pflwr.jpg?width=265&height=265&canvas=265,265&optimize=medium&fit=bounds",
Regenafill&trade; Bone Graft Plug,Safco Dental,PFWRL,Sutures & surgical products,https://www.safcodental.com/product/regenafill-sup-trade-sup-bone-graft-plug,$259.99,,In Stock,"Composed of 80% carbonate phosphate based mineral with a carbonate apatite structure combined with 20% Type I Achilles bovine tendon collagen. This mineral is physically and chemically comparable to the mineralized matrix of human bone, which makes it an excellent choice for socket preservation. No membrane needed in most cases. &nbsp;
Intended for use in dental surgery including:
&bull; Augmentation or reconstructive treatment of the alveolar ridge.&bull; Filling of infrabony periodontal defects.&bull; Filling of defects after root resection, apicoectomy, and cystectomy.&bull; Filling of extraction sockets to enhance preservation of alveolar ridge.&bull; Elevation of the maxillary sinus floor.&bull; Filling of periodontal defects in conjunction with GTR. &bull; Filling of peri-implant defects in conjunction with GBR.",{},"https://www.safcodental.com/media/catalog/product/p/f/pfwrl.jpg?width=265&height=265&canvas=265,265&optimize=medium&fit=bounds",
Surgicel&reg;,Safco Dental,PFPHJ,Sutures & surgical products,https://www.safcodental.com/product/surgicel-reg,$1118.99,,In Stock,"Sterile, shear-weave, absorbable hemostat used to control bleeding in tooth extractions and oral surgery. Produced from oxidized&nbsp;regenerated cellulose to ensure purity and consistency. Fully absorbable within 7-14 days. Strong yet flexible and malleable to conform to irregular&nbsp;surfaces; may be folded or cut to size.",{},"https://www.safcodental.com/media/catalog/product/p/f/pfphj.jpg?width=265&height=265&canvas=265,265&optimize=medium&fit=bounds",
R.T.R.+ Syringe,Safco Dental,PFWRU,Sutures & surgical products,https://www.safcodental.com/product/r-t-r-syringe,$152.99,,In Stock,"Sterile and fully resorbable synthetic bone grafting material. Ideal osteogenic matrix mimics human bone. Available in 2 biphasic&nbsp;&beta;-TCP (&beta;-Tricalcium phosphate) / Hydroxyapatite formulations:

40%/60%: New bone formation gradually forms at the same pace as natural bone.
80%/20%: New natural bone will generate at an accelerated pace.

Indications include: post-extraction socket preservation, periodontal defects, infrabony defects, peri-implant defects, sinus lift, ridge augmentation, and cystic cavities.",{},"https://www.safcodental.com/media/catalog/product/p/f/pfwru.jpg?width=265&height=265&canvas=265,265&optimize=medium&fit=bounds",
Disposable scalpels - Bard-Parker (BD),Safco Dental,PFLUG,Sutures & surgical products,https://www.safcodental.com/product/disposable-scalpels-bard-parker-bd,$18.99,,In Stock,"Sterile disposable scalpel with a stainless steel blade.&nbsp;Intended for tissue separation, and other procedures that require a sharp surgical blade to puncture or cut.
Offers the superior cutting advantages of stainless steel technology.

Consistent sharpness, control and strength.
Uniquely packaged for safety and ease of use.
Sterile.
Not made with natural rubber latex
",{},"https://www.safcodental.com/media/catalog/product/p/f/pflug.jpg?width=265&height=265&canvas=265,265&optimize=medium&fit=bounds",
Soft Tissue Trimmer,Safco Dental,PFLWH,Sutures & surgical products,https://www.safcodental.com/product/soft-tissue-trimmer,$139.99,,In Stock,FG bur designed for soft tissue surgery. Can be used as an alternative to electrosurgery and surgical blades; functions as a rotating scalpel for soft tissue that promotes coagulation for minimal bleeding. Biocompatible&nbsp;hard oxide point cuts tissue without burning. Autoclavable.,{},"https://www.safcodental.com/media/catalog/product/p/f/pflwh.jpg?width=265&height=265&canvas=265,265&optimize=medium&fit=bounds",
Feather&reg;&nbsp;Microsurgical Blades,Safco Dental,PFLVV,Sutures & surgical products,https://www.safcodental.com/product/feather-sup-reg-nbsp-sup-microsurgical-blades,$89.99,,In Stock,"Advanced instrument system of interchangeable blades and handles.

Ultra-sharp, retains cutting efficiency.
Ideal for microsurgery &amp; use with a microscope.
Optimal shapes &amp; blade thickness.
Small tips for surgical precision.
Variety of applications including periodontal &amp; regenerative surgery.
Multiple handle designs.
Made of high-quality stainless steel
All blades are gamma-sterilized and can be used immediately after opening the package.&nbsp;
",{},"https://www.safcodental.com/media/catalog/product/p/f/pflvv.jpg?width=265&height=265&canvas=265,265&optimize=medium&fit=bounds",
Safety Scalpels,Safco Dental,PFLVZ,Sutures & surgical products,https://www.safcodental.com/product/safety-scalpels,$38.49,,In Stock,"Retractable blade scalpel offers ultimate safety.

Sterile Stainless steel, razor-sharp cutting edge.
Advance blade with slider in one motion.
Blade locks into place with audible confirmation.
Retract with one motion to protected position.
Metric ruler on each scalpel.
Individually packaged.

&nbsp;",{},"https://www.safcodental.com/media/catalog/product/p/f/pflvz.jpg?width=265&height=265&canvas=265,265&optimize=medium&fit=bounds",
Ossify&reg; Cortical Bone Sheet,Safco Dental,PFWRG,Sutures & surgical products,https://www.safcodental.com/product/ossify-sup-reg-sup-cortical-bone-sheet,$149.49,,In Stock,"Ossify Bone Sheet is 100% laminar cortical bone that has been demineralized, which makes it flexible allowing it to be contoured, molded and trimmed. This enables it to be used as a membrane and can be screwed, tacked or sutured into place. It can be placed alone or in combination with particulate allograft to regenerate larger defects. It comes pre-hydrated and ready to use. &nbsp; &nbsp;",{},"https://www.safcodental.com/media/catalog/product/p/f/pfwrg.jpg?width=265&height=265&canvas=265,265&optimize=medium&fit=bounds",
Surgifoam&reg;,Safco Dental,PFPJK,Sutures & surgical products,https://www.safcodental.com/product/surgifoam-reg,$214.49,,In Stock,"
Ethicon has a supply disruption on&nbsp;Surgifoam size 2cm x 6cm x 0.7cm (Safco #258-0512).&nbsp;Safco is not accepting orders until we receive inventory. Please order size&nbsp;1cm x 1cm x 1cm (Safco #258-0524) as a substitute.
Sterile, water insoluble, malleable porcine gelatin absorbable sponge, intended for hemostatic use by applying to a bleeding surface.

Use in oral surgery for the obliteration of dead space created by simple extraction, root amputation and removal of cysts, tumors and impacted teeth.
Rapid hemostasis.
Easy to handle: compressible, does not require any cutting.
Absorbs up to 40 times its own weight.
Bioresorbable.

The sponge is porous and off-white in appearance.
",{},"https://www.safcodental.com/media/catalog/product/p/f/pfpjk.jpg?width=265&height=265&canvas=265,265&optimize=medium&fit=bounds",
Myco Medical Technocut&reg; Disposable Scalpels,Safco Dental,PFLXA,Sutures & surgical products,https://www.safcodental.com/product/myco-medical-technocut-reg-disposable-scalpels,$8.99,,In Stock,"
Non-slip, clear shield improves safety and enables easy blade size identification
Ergonomic, non-slip plastic handle with integrated metric ruler for convenience
Scalpel blades produced from high-quality Swiss stainless steel
100% automated inspection verifies the blade to handle attachment
Cold-staking used for attaching blade to handle, improving consistency
Scalpels manufactured in facilities that conform to ISO 13485
",{},"https://www.safcodental.com/media/catalog/product/p/f/pflxa.jpg?width=265&height=265&canvas=265,265&optimize=medium&fit=bounds",
Clearance item,Safco Dental,BCCCC,Sutures & surgical products,https://www.safcodental.com/product/clearance-item,$276.68,,In Stock,"Grab incredible deals on open-box clearance items. Shop now and save big on top-quality products. Limited stock available, so act fast!Perfect for quality and savings. &nbsp;These like-new items at unbeatable prices! Fully inspected and in excellent working condition. These items are all eligible for our generous Safco return and warranty policy. &nbsp;Please note, some may be missing minor, non-essential accessories &ndash; please contact your account manager to find out the details of the items you are interested in.",{},,
Disposable scalpels - Integra Miltex,Safco Dental,PFLUN,Sutures & surgical products,https://www.safcodental.com/product/disposable-scalpels-integra-miltex,$19.49,,In Stock,Sterile disposable scalpel; plastic handle with a stainless steel blade. Razor&nbsp;sharp for superior cutting and a clean incision.,{},"https://www.safcodental.com/media/catalog/product/p/f/pflun.jpg?width=265&height=265&canvas=265,265&optimize=medium&fit=bounds",
Ossify&reg; DBM Cortical Fiber Bone Graft,Safco Dental,PFWRF,Sutures & surgical products,https://www.safcodental.com/product/ossify-sup-reg-sup-dbm-cortical-fiber-bone-graft,$121.49,,In Stock,"Ossify DBM Fiber is a next generation bone allograft composed of interwoven demineralized cortical bone fibers. It is configured both by itself and with the addition of 1-1.5mm mineralized cancellous particles. This unique allograft provides an ideal scaffold for bone formation with its extremely high surface area and its optimum shape conforming properties, making it highly osteoconductive. In addition, it has great osteoinductive potential due to the specialized demineralized process. The graft hydrates very uniformly with PRP, blood or saline for maximum handling. It can be used in a variety of surgical applications, including socket grafting, GBR, sinus augmentation, and other bone grafting procedures.",{},"https://www.safcodental.com/media/catalog/product/p/f/pfwrf.jpg?width=265&height=265&canvas=265,265&optimize=medium&fit=bounds",
DentalProX VeraGraft&trade; Dental Powder,Safco Dental,PFWVG,Sutures & surgical products,https://www.safcodental.com/product/dentalprox-veragraft-trade-dental-powder,$28.99,,In Stock,"
Safe alternative to an autograft with no need for a second surgical site
Osteoconductive
Used for volumetric enhancement, space maintenance, and faster remodeling
Sterile ground dental powder is available in cortical, cancellous and a cortical/cancellous mix.&nbsp;
Validated to a sterility assurance level (SAL) of 10(-6) in accordance with ISO 11137-2 Method 1.
",{},"https://www.safcodental.com/media/catalog/product/p/f/pfwvg.jpg?width=265&height=265&canvas=265,265&optimize=medium&fit=bounds",
Orabloc,Safco Dental,AEAAY,Injectable Anesthetics,https://www.safcodental.com/product/orabloc-sup-reg-sup,$59.99,,In Stock,"Articaine HCl 4% and epinephrine injection, USP. 1.8ml cartridges.",{},"https://www.safcodental.com/media/catalog/product/a/e/aeaay.jpg?width=265&height=265&canvas=265,265&optimize=medium&fit=bounds",
Cartridge dispenser & warmer,Safco Dental,AEAXA,Injectable Anesthetics,https://www.safcodental.com/product/cartridge-dispenser-warmer,$7.99,,In Stock,Heats up to 60 cartridges to approximate body temperature to avoid anesthetic trauma from thermal shock. Cartridge is dispensed by pressing top panel. May be mounted on wall or placed on cabinet.,{},"https://www.safcodental.com/media/catalog/product/a/e/aeaxa.jpg?width=265&height=265&canvas=265,265&optimize=medium&fit=bounds",
Articadent,Safco Dental,AEAAX,Injectable Anesthetics,https://www.safcodental.com/product/articadent-reg,$60.99,,In Stock,"Articaine HCl 4% and epinephrine injection, USP. 1.7ml cartridges.",{},"https://www.safcodental.com/media/catalog/product/a/e/aeaax.jpg?width=265&height=265&canvas=265,265&optimize=medium&fit=bounds",
BufferPro™,Safco Dental,AEABP,Injectable Anesthetics,https://www.safcodental.com/product/bufferpro-sup-trade-sup,$81.49,,In Stock,"BufferPro offers an elegant, one-step solution for buffering dental local anesthetics. BufferPro dispenses 0.1mL of sodium bicarbonate into a dental anesthetic cartridge to raise the pH of the anesthetic solution close to physiologic levels. BufferPro is a single-use, sterile packaged, self-contained capsule with no measuring, mixing, or additional accessories.&nbsp;",{},"https://www.safcodental.com/media/catalog/product/a/e/aeabp.jpg?width=265&height=265&canvas=265,265&optimize=medium&fit=bounds",
Septocaine,Safco Dental,AEAAM,Injectable Anesthetics,https://www.safcodental.com/product/septocaine-reg,$69.99,,In Stock,"Articaine HCl 4% and epinephrine injection, USP. 1.7ml cartridges.",{},"https://www.safcodental.com/media/catalog/product/a/e/aeaam.jpg?width=265&height=265&canvas=265,265&optimize=medium&fit=bounds",
Xylocaine,Safco Dental,AEAAF,Injectable Anesthetics,https://www.safcodental.com/product/xylocaine-reg,$56.49,,In Stock,"Lidocaine HCI 2% and epinephrine injection, USP. 1.7ml cartridges.",{},"https://www.safcodental.com/media/catalog/product/a/e/aeaaf.jpg?width=265&height=265&canvas=265,265&optimize=medium&fit=bounds",
Citanest,Safco Dental,AEAAD,Injectable Anesthetics,https://www.safcodental.com/product/citanest-reg,$64.99,,In Stock,"Prilocaine HCI 4% Injection,&nbsp;USP. 1.7ml cartridges.",{},"https://www.safcodental.com/media/catalog/product/a/e/aeaad.jpg?width=265&height=265&canvas=265,265&optimize=medium&fit=bounds",
Safco Mepivacaine,Safco Dental,AEAAJ,Injectable Anesthetics,https://www.safcodental.com/product/safco-mepivacaine,$63.99,,In Stock,"Mepivacaine HCl 3% injection, USP plain (no vasoconstrictor). 1.7ml cartridges.",{},"https://www.safcodental.com/media/catalog/product/a/e/aeaaj.jpg?width=265&height=265&canvas=265,265&optimize=medium&fit=bounds",
Carbocaine,Safco Dental,AEAAB,Injectable Anesthetics,https://www.safcodental.com/product/carbocaine-reg,$74.99,,In Stock,"Carbocaine 3%: Mepivacaine hydrochloride injection, USP.
Carbocaine 2% with Neo-Cobefrin 1:20,000: Mepivacaine hydrochloride and levonordefrin injection, USP.
1.7ml cartridges.",{},"https://www.safcodental.com/media/catalog/product/a/e/aeaab.jpg?width=265&height=265&canvas=265,265&optimize=medium&fit=bounds",
Polocaine,Safco Dental,AEAAE,Injectable Anesthetics,https://www.safcodental.com/product/polocaine-reg,$74.99,,In Stock,"Mepivacaine HCI 3% injection,&nbsp;USP. 1.7ml cartridges.",{},"https://www.safcodental.com/media/catalog/product/a/e/aeaae.jpg?width=265&height=265&canvas=265,265&optimize=medium&fit=bounds",
Safco Lidocaine,Safco Dental,AEAAI,Injectable Anesthetics,https://www.safcodental.com/product/safco-lidocaine,$48.49,,In Stock,"Lidocaine HCl 2% and epinephrine 1:100,000 injection, USP. 1.7ml cartridges.",{},"https://www.safcodental.com/media/catalog/product/a/e/aeaai.jpg?width=265&height=265&canvas=265,265&optimize=medium&fit=bounds",
Lignospan,Safco Dental,AEAAK,Injectable Anesthetics,https://www.safcodental.com/product/lignospan-reg,$64.49,,In Stock,"Lidocaine HCl 2% and epinephrine injection, USP.&nbsp;1.7ml cartridges.",{},"https://www.safcodental.com/media/catalog/product/a/e/aeaak.jpg?width=265&height=265&canvas=265,265&optimize=medium&fit=bounds",
Marcaine,Safco Dental,AEAAC,Injectable Anesthetics,https://www.safcodental.com/product/marcaine-reg,$102.99,,In Stock,"Marcaine 0.5% with epinephrine&nbsp;1:200,000 injection (as bitartrate) (bupivacaine hydrochloride and&nbsp;epinephrine injection, USP). 1.8ml cartridges.",{},"https://www.safcodental.com/media/catalog/product/a/e/aeaac.jpg?width=265&height=265&canvas=265,265&optimize=medium&fit=bounds",
OraVerse,Safco Dental,AEAAW,Injectable Anesthetics,https://www.safcodental.com/product/oraverse-reg,$108.99,,In Stock,"Click here to see full prescribing information
Local anesthesia reversal agent restores normal sensation to your patients in half the time.1

Can prevent oral hematomas, especially in children and special needs patients.
Great for patients who are uncomfortable with the feeling of numbness, or who need normal sensation returned quickly.

Accelerates the return&nbsp;to normal sensation and function after routine procedures where local anesthetic containing a vasoconstrictor was used. Not recommended for use in children less than 6 years old or weighing less than 15 kg (33 lbs.)
Important safety information:&nbsp;In clinical trials, the most common adverse events with OraVerse (phentolamine mesylate) vs. control were post procedural pain (6% vs. 6%), injection site pain (5% vs. 4%), tachycardia (5% vs. 6%), bradycardia (2% vs. 0.3%) and headache (3% vs. 4%). Following parenteral use of phentolamine in non-dental indications, myocardial infarction and cerebrovascular spasm and occlusion have been reported, usually in association with marked hypotensive episodes producing shock-like states. Although such effects are uncommon with OraVerse, clinicians should be alert to the signs and symptoms of tachycardia and cardiac arrhythmias, particularly in patients with a history of cardiovascular disease, as these symptoms may occur with the use of phentolamine or other alpha-adrenergic blocking agents.
1Hersh EV, Moore PA, Papas AS, and colleagues. Reversal of soft-tissue anesthesia with phentolamine mesylate in adolescents and adults. JADA 2008;139(8):1080-1093. © 2008 American Dental Association. All rights reserved.",{},"https://www.safcodental.com/media/catalog/product/a/e/aeaaw.jpg?width=265&height=265&canvas=265,265&optimize=medium&fit=bounds",
Safco Articaine,Safco Dental,AEAAZ,Injectable Anesthetics,https://www.safcodental.com/product/safco-articaine,$55.99,,In Stock,"Articaine HCl 4% and epinephrine injection. 1.8ml cartridges.
Product Features:

Indicated for local, infiltrative, or conductive anesthesia in both simple and complex dental procedures.
Rapid onset of anesthesia within 1 – 9 minutes.
Complete anesthesia lasts about 1 hour for infiltrations, up to 2 hours for nerve block.

&nbsp;
Risk information:
Safco Articaine contains sodium metabisulfite. Safco Articaine is contraindicated in patients who are hypersensitive to products containing sulfites. Products containing sulfites may cause allergic-type reactions including anaphylactic symptoms and life-threatening or less severe asthmatic episodes. Care should be taken to avoid accidental intravascular injection, which may be associated with convulsions followed by coma and respiratory arrest. Local anesthetic solutions that contain a vasoconstrictor should be used cautiously, especially in patients with impaired cardiovascular function or vascular disease. Administration of Safco Articaine results in a 3 to 5 fold increase in plasma epinephrine concentration compared to baseline. However, in healthy adults it does not appear to be associated with marked increases in blood pressure or heart rate, except in the case of accidental intravascular injection. The most common adverse reactions (incidence &gt;2%) are headache and pain. Inform patients in advance of the possibility of temporary loss of sensation and muscle function during infiltration and nerve block injections. Instruct patients not to eat or drink until normal sensation returns.
Click here to see full prescribing information.",{},"https://www.safcodental.com/media/catalog/product/a/e/aeaaz.jpg?width=265&height=265&canvas=265,265&optimize=medium&fit=bounds",
Hygenic&reg; Wedjets&reg;,Safco Dental,NDJQZ,Dental Dam,https://www.safcodental.com/product/hygenic-sup-reg-sup-wedjets-sup-reg-sup,$30.49,,In Stock,"Wedjets&reg; Dental Dam stabilizing cord provides an alternative to conventional clamps.

Quick and easy dam retention.
Available in both latex and non-latex.
Use to complement or supplement clamp usage to help keep dental dam in place and in a dry, isolated field.
",{},"https://www.safcodental.com/media/catalog/product/n/d/ndjqz.jpg?width=265&height=265&canvas=265,265&optimize=medium&fit=bounds",
Ivory&reg; Tiger rubber dam clamps,Safco Dental,NDPLR,Dental Dam,https://www.safcodental.com/product/ivory-reg-tiger-rubber-dam-clamps,$31.49,,In Stock,Ivory&reg;&nbsp;tiger rubber dam clamps from Kulzer feature serrated jaws. The tension of each clamp is meticulously hand set and suited for the corresponding tooth on which it is designed to be used.,{},"https://www.safcodental.com/media/catalog/product/n/d/ndplr.jpg?width=265&height=265&canvas=265,265&optimize=medium&fit=bounds",
Hu-Friedy rubber dam clamps,Safco Dental,NDPSL,Dental Dam,https://www.safcodental.com/product/hu-friedy-rubber-dam-clamps,$19.99,,In Stock,"The Hu-Friedy Satin Steel&reg; rubber dam clamps are for anterior, premolar and molar applications. The Satin Steel&reg; matte finish helps reduce the glare caused by operatory lights for less eye fatigue and improved clinical outcomes. These rubber dam clamps are available in a variety of sizes to help you perform at your best.",{},"https://www.safcodental.com/media/catalog/product/n/d/ndpsl.jpg?width=265&height=265&canvas=265,265&optimize=medium&fit=bounds",
Ivory&reg; specialty rubber dam clamps,Safco Dental,NDPJB,Dental Dam,https://www.safcodental.com/product/ivory-reg-specialty-rubber-dam-clamps,$25.49,,In Stock,Choose from a&nbsp;wide variety of uniquely designed Ivory rubber dam clamps&nbsp;to find the perfect one for each tooth. Our line includes a clamp for every application. Every single clamp is crafted in the USA from high-grade stainless steel and carefully hand-set so that you can confidently affix the rubber dam whenever it&rsquo;s needed.,{},"https://www.safcodental.com/media/catalog/product/n/d/ndpjb.jpg?width=265&height=265&canvas=265,265&optimize=medium&fit=bounds",
Hygenic&reg; rubber dam clamps,Safco Dental,NDPNJ,Dental Dam,https://www.safcodental.com/product/hygenic-reg-rubber-dam-clamps,$17.49,,In Stock,"Hygenic&reg; Gloss Finish Winged Clamps &ndash; Application steps can be combined by placing the dam, clamps and frame simultaneously. Once applied, the dam is stretched under the wings of the clamp.",{},"https://www.safcodental.com/media/catalog/product/n/d/ndpnj.jpg?width=265&height=265&canvas=265,265&optimize=medium&fit=bounds",
