name,brand,sku,category_hierarchy,url,price,unit_pack_size,availability,description,specifications,image_urls,alternative_products
RelyX Unicem Maxicap,Safco Dental,AZTMQ,Cements and liners,https://www.safcodental.com/product/3m-trade-relyx-trade-unicem-maxicap-trade,$194.99,,In Stock,"Dual cure self-adhesive universal resin cement. Eliminates the need for etching*, priming, and bonding steps. Provides high physical strength, low linear expansion, and excellent marginal integrity.
Maxicap&trade; capsule delivery is ideal for multi-unit bridges. The hygienic unidose&nbsp;(936mg) capsule provides a consistent mix with&nbsp;triturator. 2&rsquo; 30&rdquo; working time. Requires&nbsp;a Maxicap&trade; activator (blue base) and applier&nbsp;(blue button).
*Except for 2- or 3-unit Maryland bridges and 3-unit inlay/onlay bridges, which require selective etching to increase surface area for bonding.",{},"https://www.safcodental.com/media/catalog/product/a/z/aztmq.jpg?width=265&height=265&canvas=265,265&optimize=medium&fit=bounds",
3M™ RelyX™ Universal Resin Cement,Safco Dental,AZTMV,Cements and liners,https://www.safcodental.com/product/3m-trade-relyx-trade-universal-resin-cement,$31.49,,In Stock,"Universal dual-cure resin cement for virtually all adhesives and self-adhesive indications. Works great as a standalone, self-adhesive cement, plus further enhanced bond strength to all substrates when combined with 3M Scotchbond Universal Plus Adhesive. Covers virtually all resin cement indications including veneers, inlays and onlays, crowns, bridges, posts and screws.
Excellent bond strength.

High esthetics by color-stable, fluorescent shades.
Easy clean-up.
Unique self-sealing automix syringe with exclusive micro mixing tips minimizes cement waste by 80% over other automix tips* - you get 15 applications** from one 3.4g syringe!

*per application compared to currently available standard automix systems.**on average
&nbsp;",{},"https://www.safcodental.com/media/catalog/product/a/z/aztmv.jpg?width=265&height=265&canvas=265,265&optimize=medium&fit=bounds",
Riva Cem Automix,Safco Dental,AZTNW,Cements and liners,https://www.safcodental.com/product/riva-cem-automix,$83.49,,In Stock,"Self-curing, radiopaque, fluoride releasing paste/paste resin modified glass-ionomer luting cement. Features ionglass&trade; technology, a unique blend of different sized reative glass particles that harnesses ion-release to cross-link polycarboxylic acid chains. This focused ion release results in a higher bond strength and more stable aesthetic properties.

Light tack cure option for easy removal of excess paste.
High flexural strength.
High bond strength to enamel and dentine.
BPA free.
Sustained fluoride release.
Light yellow shade.
More tips with less waste than other cements.
",{},"https://www.safcodental.com/media/catalog/product/a/z/aztnw.jpg?width=265&height=265&canvas=265,265&optimize=medium&fit=bounds",
SoloCem,Safco Dental,AZTPF,Cements and liners,https://www.safcodental.com/product/solocem-reg,$162.49,,In Stock,"Dual-cure, self-adhesive resin cement with antibacterial zinc oxide that ensures reliable, tight restoration, in concert with a particularly low level of shrinkage.
SoloCem offers:

Antibacterial zinc oxide.
Time-saving, simplified handling.
Low shrinkage.
High adhesion values.

Indicated for a broad range of procedures including crowns and bridges, root posts, inlays and onlays, as well as implant abutments.",{},"https://www.safcodental.com/media/catalog/product/a/z/aztpf.jpg?width=265&height=265&canvas=265,265&optimize=medium&fit=bounds",
ZR-Cem,Safco Dental,AZTZA,Cements and liners,https://www.safcodental.com/product/zr-cem-trade,$157.99,,In Stock,"Dual-cure, self-etch, self-adhesive universal resin cement specifically formulated for zirconia restorations. Optimal viscosity and easy handling enables a strong bond to all ceramic materials, dentin and enamel. Virtually no post-operative sensitivity. Strong color stability in the mouth over time.",{},"https://www.safcodental.com/media/catalog/product/a/z/aztza.jpg?width=265&height=265&canvas=265,265&optimize=medium&fit=bounds",
Set PP,Safco Dental,AZTPC,Cements and liners,https://www.safcodental.com/product/set-pp,$229.49,,In Stock,"Self-etch, self-adhesive, dual-cure resin cement for final cementation of metal, resin and ceramic based restorations such as inlays, crowns and bridges; also indicated for use with pins, posts and screws. No Bisphenol A or HEMA. High fluoride release. Radiopaque.
Refrigeration suggested; this product is stored under refrigeration at Safco.",{},"https://www.safcodental.com/media/catalog/product/a/z/aztpc.jpg?width=265&height=265&canvas=265,265&optimize=medium&fit=bounds",
Secure,Safco Dental,AZTNX,Cements and liners,https://www.safcodental.com/product/secure-reg,$41.99,,In Stock,"
Dual-cure 4-META adhesive resin cement. Generates strong bond to tooth with use of unique self-etch primer; no separate etching. Effectively seals the tooth against marginal leakage and subsequent sensitivity. You can either light cure for 40 seconds, or wait for it to self cure in approximately 2&frac12; minutes.
SEcure cement and self-etch primer require refrigeration; these products are stored under refrigeration at Safco.
&nbsp;
",{},"https://www.safcodental.com/media/catalog/product/a/z/aztnx.jpg?width=265&height=265&canvas=265,265&optimize=medium&fit=bounds",
Brilliant Bulk Fill Flow,Safco Dental,BGQBQ,Composite Filling - Flowable,https://www.safcodental.com/product/brilliant-bulk-fill-flow,$16.99,,In Stock,"New filling material in the Coltene Brilliant family for quick and easy posterior restorations. Based on the BRILLIANT filling technology, Bulk Fill Flow is characterized by its reliable: One Multi-Shade which adapts effortlessly to a variety of tooth shades thanks to its chameleon effect, 4mm curing depth, high flexural strength and low shrinkage. Excellent abrasion resistance and no capping layer needed.&nbsp;&nbsp;

One adaptive Multi-Shade material.
4mm reliable curing depth polymerized in 20 seconds.
No top layer needed due to high abrasion resistance and good mechanical properties.
Adapts to a wide range of tooth shades due to its chameleon effect.
",{},"https://www.safcodental.com/media/catalog/product/c/o/coltene_brilliant_bulk_fill_flow_60033280_4.jpg?width=265&height=265&canvas=265,265&optimize=medium&fit=bounds",
Virtuoso Flowable,Safco Dental,BGQWF,Composite Filling - Flowable,https://www.safcodental.com/product/virtuoso-reg-flowable,$107.99,,In Stock,"Light-cured, low viscosity resin composite with smooth, easy handling characteristics. Ideal problem solver for small restorations with difficult access, reaching the proximal box of Class II restorations, or for repairing margins and adding to provisionals. Contains fluoride.",{},"https://www.safcodental.com/media/catalog/product/b/g/bgqwf.jpg?width=265&height=265&canvas=265,265&optimize=medium&fit=bounds",
SDR Flow+,Safco Dental,BGQSJ,Composite Filling - Flowable,https://www.safcodental.com/product/sdr-reg-flow,$37.99,,In Stock,"Bulk fill flowable direct restorative material featuring a unique self-leveling handling which provides excellent cavity adaptation and minimizes the need for instrument manipulation.
Indicated as a base for Class I and II cavities, pit and fissures, core build-ups, conservative Class I&rsquo;s, Class III and V restorations. The flowable composite can be used in up to 4mm increments which reduces placement time by up to 40%. Provides increased wear resistance and higher radiopacity.
&nbsp;",{},"https://www.safcodental.com/media/catalog/product/b/g/bgqsj_2.jpg?width=265&height=265&canvas=265,265&optimize=medium&fit=bounds",
Venus Bulk Flow One,Safco Dental,BGQVU,Composite Filling - Flowable,https://www.safcodental.com/product/venus-reg-bulk-flow-one,$54.99,,In Stock,"Flowable one shade bulk fill composite that can be used in up to 4mm increments without an additional capping layer. Blends seamlessly into the surrounding dentition, independent of tooth shade. High radiopacity, low shrinkage stress, high flexural strength and wear resistance.",{},"https://www.safcodental.com/media/catalog/product/b/g/bgqvu.jpg?width=265&height=265&canvas=265,265&optimize=medium&fit=bounds",
Stela,Safco Dental,BGQSE,Composite Filling - Flowable,https://www.safcodental.com/product/stela,$74.99,,In Stock,"Stela is the ultimate high-performance self-cure flowable composite and the ideal restorative for Classes I, II, III, and V. Stela Primer contains a catalyst that initiates the curing process at the restoration interface and not from the occlusal surface like traditional light curing processes. This polymerization sequence mitigates stress to enable a gap-free interface, reducing post operative sensitivity and the risk of premature failure.
Stela is applied in a simplified two-step process; primer, then composite. Stela restorations are ready for placement in just 15 seconds. This is achieved by eliminating traditional steps of etch, prime, bond, and light cure, ultimately reducing patient in-chair time.
Stela is available in a single shade with chameleon capabilities to blend in with surrounding dentition. The composite contains fluoride, calcium, and strontium, and is free of BPAs and HEMA.

Gap free
Unlimited depth of cure
Simple 2 step system, just prime and fill.
No photo-cure required
One shade
High strength
Outstanding radiopacity

For additional information,&nbsp;click here.
For Instructions for Use,&nbsp;click here.",{},"https://www.safcodental.com/media/catalog/product/b/g/bgqse.jpg?width=265&height=265&canvas=265,265&optimize=medium&fit=bounds",
Solventum™ Filtek™ Easy Match Flowable Restorative,Safco Dental,BGQFF,Composite Filling - Flowable,https://www.safcodental.com/product/solventum-filtek-easy-match-flowable,$94.29,,In Stock,"Three shades, intuitive shade selection and virtually no bubbles. Solventum™ Filtek™ Easy Match Flowable Restorative is a three-shade system that simplifies anterior and posterior restorations. Its naturally-adaptive opacity provides enamel-like translucency where you need it and dentin-like opacity everywhere else, without the need for a blocker. Use on its own or pair with 3M™ Filtek™ Easy Match Universal Restorative. The Bright, Natural and Warm shades provide an excellent shade match to most patients’ smiles.
Simple and intuitive shade selection for anterior and posterior restorations.Just three shades match 3M™ Filtek™ Easy Match Universal Restorative — and provide an excellent shade match to the classical VITA shade guide.Naturally-adaptive opacity provides enamel-like translucency on the bevel and incisal edge, and dentin-like opacity everywhere else — without needing a blocker.Virtually no bubbles or material run-on.Made with Filtek’s TRUE nanotechnology for excellent polish retention and wear resistance.Offers excellent adaptation for a range of indications and techniques.Simplified and streamlined inventory; reduces waste for infrequently used shades.Easy-to-bend cannula for precise placement.Ergonomic plunger design is easy to hold and dispense.Can be warmed up to 70°C/158°F for up to one hour and up to 25 times with the Solventum™ Filtek™ Composite Warmer.",{},"https://www.safcodental.com/media/catalog/product/b/g/bgqff.jpg?width=265&height=265&canvas=265,265&optimize=medium&fit=bounds",
Tetric EvoFlow&reg; Bulk Fill,Safco Dental,BGQTS,Composite Filling - Flowable,https://www.safcodental.com/product/tetric-evoflow-reg-bulk-fill,$24.49,,In Stock,"Bulk fill version of Tetric EvoFlow. Can be placed in 4mm increments and cured in just 10 seconds. Self-adapts to the prep to eliminate gaps and provides a level base for the subsequent sculptable composite layer.&nbsp;
Available in 3 shades:

IVA &ndash; between A2 and A3
IVB &ndash; between B1 and B2
IVW &ndash; whitish; e.g. deciduous teeth

The manufacturer has notified Safco as of December 1, Tetric EvoFlow Bulk Fill has transitioned to&nbsp;Tetric PowerFlow.",{},"https://www.safcodental.com/media/catalog/product/b/g/bgqts.jpg?width=265&height=265&canvas=265,265&optimize=medium&fit=bounds",
Vertise Flow,Safco Dental,BGQWA,Composite Filling - Flowable,https://www.safcodental.com/product/vertise-trade-flow,$98.49,,In Stock,"Self-adhering, light-cured, resin-based flowable composite restorative. Greatly simplifies the direct placement procedure by incorporating the bonding agent into the composite material. Creates both a chemical bond and a micromechanical inter-penetrating network between polymerized monomers and collagen fibers, including the smear layer of dentin. Acid-resistant zone between the composite and dentin ensures a long-lasting bond.Refrigeration required; this product is stored under refrigeration at Safco.",{},"https://www.safcodental.com/media/catalog/product/b/g/bgqwa.jpg?width=265&height=265&canvas=265,265&optimize=medium&fit=bounds",
Venus Diamond Flow,Safco Dental,BGQVV,Composite Filling - Flowable,https://www.safcodental.com/product/venus-sup-reg-sup-diamond-flow,$51.49,,In Stock,"Light-cured, nano-technology flowable composite that offers high radiopacity, low shrinkage and high flexural strength. Use as a base/liner, pit and fissure sealant, for Class V restoration, and minimally invasive Class I, II and III restorations.
Pure shades cover up to 90% of anterior and posterior restorations, simplifying restorations and saving chair time.",{},"https://www.safcodental.com/media/catalog/product/b/g/bgqvv.jpg?width=265&height=265&canvas=265,265&optimize=medium&fit=bounds",
StartFlow,Safco Dental,BGQSD,Composite Filling - Flowable,https://www.safcodental.com/product/startflow-trade,$107.49,,In Stock,Light-cured micro-hybrid flowable resin. Sub-micron particle size for superior polishability. Radiopaque and fluoride releasing. Natural fluorescence.,{},"https://www.safcodental.com/media/catalog/product/b/g/bgqsd.jpg?width=265&height=265&canvas=265,265&optimize=medium&fit=bounds",
TPH Spectra ST Flow,Safco Dental,BGQVB,Composite Filling - Flowable,https://www.safcodental.com/product/tph-spectra-reg-st-flow,$32.49,,In Stock,"Flowable composite with SphereTEC filler technology brings enhanced simplicity and versatility to traditional flowable indications.

Excellent chameleon blending ability enables 5 shades to cover the full VITA range.
Flow on-demand handling provides optimum versatility.
High strength, polish, and stain resistance.
",{},"https://www.safcodental.com/media/catalog/product/b/g/bgqvb.jpg?width=265&height=265&canvas=265,265&optimize=medium&fit=bounds",
Venus Flow,Safco Dental,BGQVW,Composite Filling - Flowable,https://www.safcodental.com/product/venus-reg-flow,$60.49,,In Stock,"Flowable, light-cured, hybrid composite containing 62% filler by weight. It is indicated for use as a base/liner, pit and fissure sealant, for Class V restoration, and minimally invasive Class I, II, and III restorations.",{},"https://www.safcodental.com/media/catalog/product/b/g/bgqvw.jpg?width=265&height=265&canvas=265,265&optimize=medium&fit=bounds",
Tetric PowerFlow,Safco Dental,BGQTT,Composite Filling - Flowable,https://www.safcodental.com/product/tetric-reg-powerflow,$56.49,,In Stock,"Tetric&reg; PowerFlow is a nano hybrid, flowable, posterior 4-mm composite with all the benefits of Ivocerin.
When used with Bluephase&reg; PowerCure curing light, and Adhese Universal&reg; adhesive, Tetric&reg; PowerFill sculptable universal and Tetric&reg; PowerFlow composite will cure in just 3 seconds. When used with any other curing light with an intensity of 1000mW/cm2, curing time is 10 seconds.",{},"https://www.safcodental.com/media/catalog/product/b/g/bgqtt.jpg?width=265&height=265&canvas=265,265&optimize=medium&fit=bounds",
Wave,Safco Dental,BGQXA,Composite Filling - Flowable,https://www.safcodental.com/product/wave,$16.99,,In Stock,"A light-cured, flowable composite appropriate for both Class III and V, and small Class I and II lesions. The low viscosity formula allows adaptation onto all surfaces and can be placed intraorally directly from the syringe through a disposable applicator tip. Improved radiopacity and fluoride releasing.",{},"https://www.safcodental.com/media/catalog/product/b/g/bgqxa.jpg?width=265&height=265&canvas=265,265&optimize=medium&fit=bounds",
Tetric EvoFlow,Safco Dental,BGQTR,Composite Filling - Flowable,https://www.safcodental.com/product/tetric-evoflow-reg,$24.49,,In Stock,"A light-cured, nano-optimized flowable composite that provides higher radiopacity, lower shrinkage and lower wear. Perfect for use as a liner or initial layer under all composite materials. Also suitable for preventive resin restorations and the adhesive cementation technique. New ergonomic syringe and new Cavifil design feature extra-thin tips for precision application.",{},"https://www.safcodental.com/media/catalog/product/b/g/bgqtr.jpg?width=265&height=265&canvas=265,265&optimize=medium&fit=bounds",
TPH Spectra ST,Safco Dental,BGEYH,Composite Fillings - Universal,https://www.safcodental.com/product/tph-spectra-reg-st,$47.99,,In Stock,"Universal composite restorative material indicated for anterior and posterior restorations of all cavity classes. It offers excellent physical properties, brilliant polish and clinical longevity.The new formula combines the proven and trusted performance of TPH Spectra resin with innovative SphereTEC&trade; (ST) filler technology. This technology has further optimized handling that is non-sticky with improved sculptability and slump resistance. It has a simplified shading system covering the full VITA range with just five shades, and enhanced durability and speed of polish, all while maintaining excellent stain resistance.Available in 2 viscosities:LV (Low Viscosity) &ndash; creamy, spreadable consistencyHV (High Viscosity) &ndash; firmer and more packable.
With TPH Spectra ST, you only need 5 shades to cover the entire 16-shade VITA&reg;&nbsp;range:



&nbsp;TPH Spectra ST shade
VITA shade coverage


A1
A1, B1, C1


A2
A2, B2, D2


A3
A3, C2, D3, D4


A3.5
A3.5, B3, B4, C3


A4
A4, C4


",{},"https://www.safcodental.com/media/catalog/product/b/g/bgeyh.jpg?width=265&height=265&canvas=265,265&optimize=medium&fit=bounds",
Tetric EvoCeram Aligner,Safco Dental,BGEXH,Composite Fillings - Universal,https://www.safcodental.com/product/tetric-evoceram-aligner,$87.49,,In Stock,"High quality, sculptable fluorescent composite for use with clear aligners.
&bull; Optimized fluorescence for higher visibility of attachments. &bull; Supports the exact initial placement and easy removal of attachments.&bull; Pronounced chameleon effect ensures a natural shade blend.&bull; Stable and abrasion resistant.&bull; Can be used for all orthodontic clear aligner therapy and for the fixation of lingual retainers.",{},"https://www.safcodental.com/media/catalog/product/b/g/bgexh.jpg?width=265&height=265&canvas=265,265&optimize=medium&fit=bounds",
Synergy Nano Formula,Safco Dental,BGEVH,Composite Fillings - Universal,https://www.safcodental.com/product/synergy-reg-nano-formula,$125.49,,In Stock,Refractive resin matrix creates a restoration that blends into the surrounding tooth structure. Each Duo shade covers 2 Vita shades providing easier shade selection.,{},"https://www.safcodental.com/media/catalog/product/b/g/bgevh.jpg?width=265&height=265&canvas=265,265&optimize=medium&fit=bounds",
Venus Diamond One,Safco Dental,BGEYS,Composite Fillings - Universal,https://www.safcodental.com/product/venus-sup-reg-sup-diamond-one,$122.99,,In Stock,"Single-shaded composite that blends seamlessly into the surrounding dentition, independent of the tooth shade, enabling restorations to simply disappear. The shade of the restoration is determined by the absorption of the ""light waves"" that are reflected by the surrounding tooth shade. For use in both anterior and posterior restorations.
&bull; Firm, low-stick consistency.&bull; Offers non-slump qualities for easy carving and sculpting.&bull; Long-lasting due to the unique TCD-matrix for chip and fracture resistance.&bull; Entirely free of BIS-GMA and BPA related monomers.",{},"https://www.safcodental.com/media/catalog/product/b/g/bgeys.jpg?width=265&height=265&canvas=265,265&optimize=medium&fit=bounds",
TPH Spectra ST Effects,Safco Dental,BGEYK,Composite Fillings - Universal,https://www.safcodental.com/product/tph-spectra-reg-st-effects,$126.49,,In Stock,Works with the 5 universal shades of TPH Spectra ST in a simplified layering approach to achieve reliable high-end results in esthetically demanding anterior composite cases.,{},"https://www.safcodental.com/media/catalog/product/b/g/bgeyk.jpg?width=265&height=265&canvas=265,265&optimize=medium&fit=bounds",
ZNano,Safco Dental,BGEZS,Composite Fillings - Universal,https://www.safcodental.com/product/znano-trade,$69.49,,In Stock,"Universal nanocomposite that simplifies the color-matching process.

5 adaptive shades that blend easily to a patient&rsquo;s existing tooth color.
Life-like fluorescence and high polishability.
Superior physical properties and stain resistance.
Non-stick handling.
",{},"https://www.safcodental.com/media/catalog/product/b/g/bgezs.jpg?width=265&height=265&canvas=265,265&optimize=medium&fit=bounds",
Venus Pearl One,Safco Dental,BGEYU,Composite Fillings - Universal,https://www.safcodental.com/product/venus-reg-pearl-one,$121.49,,In Stock,"Single-shaded composite that blends seamlessly into the surrounding dentition, independent of the tooth shade, enabling restorations to simply disappear. The shade of the restoration is determined by the absorption of the ""light waves"" that are reflected by the surrounding tooth shade. For use in both anterior and posterior restorations.

Creamy, low-stick consistency.
Offers non-slumping qualities for easy carving and sculpting.
Long-lasting due to the unique TCD-matrix for chip and fracture resistance.
Entirely free of BIS-GMA and BPA related monomers.
",{},"https://www.safcodental.com/media/catalog/product/b/g/bgeyu.jpg?width=265&height=265&canvas=265,265&optimize=medium&fit=bounds",
3S PowerCure System,Safco Dental,BGEXZ,Composite Fillings - Universal,https://www.safcodental.com/product/3s-powercure-trade-system,$47.99,,In Stock,"Comprised of four coordinated products designed to work together for maximum efficiency and positive outcomes:

Bluephase&reg; PowerCure curing light.
Tetric&reg; PowerFill sculptable universal composite.
Tetric&reg; PowerFlow flowable composite.
Adhese Universal&reg; adhesive.

When used together, the composites and adhesive will cure in just 3 seconds. When used with any other curing light with an intensity of 1000mW/cm2, curing time is 10 seconds.",{},"https://www.safcodental.com/media/catalog/product/b/g/bgexz.jpg?width=265&height=265&canvas=265,265&optimize=medium&fit=bounds",
Tetric EvoCeram,Safco Dental,BGEXG,Composite Fillings - Universal,https://www.safcodental.com/product/tetric-evoceram-reg,$85.49,,In Stock,"Nano-optimized composite restorative. The unique combination of nano technologies in Tetric EvoCeram enables you to easily create natural-looking, single shade restorations:


Nano-fillers provide smoother surfaces for faster and easier high-gloss polishability, lower wear for long-lasting restorations, low shrinkage (&lt;1.6% for better marginal integrity), and a high level of radiopacity for easy x-ray detection.
Nano-modifiers layered within the resin matrix create more efficient handling properties and a more sculptable, non-slump, non-sticky consistency.
Nano-sized color pigments are finely distributed within the resin matrix, intensifying color nuances.


Plus, a new additive makes Tetric EvoCeram even less sensitive to ambient light and more reactive to curing lights. You get more time to model and sculpt, then a fast 10 second curing time at 1000mW/cm2.",{},"https://www.safcodental.com/media/catalog/product/b/g/bgexg.jpg?width=265&height=265&canvas=265,265&optimize=medium&fit=bounds",
Synergy D6,Safco Dental,BGEVG,Composite Fillings - Universal,https://www.safcodental.com/product/synergy-reg-d6,$16.99,,In Stock,"Nano-filled hybrid resin restorative material. Six dentin shades were created by grouping Vita shades with similar hue, chroma and value; these shades are then refined to enhance chroma and translucency, resulting in a simplified shade selection. Additional features include low shrinkage values and optimized abrasive resistance.",{},"https://www.safcodental.com/media/catalog/product/b/g/bgevg.jpg?width=265&height=265&canvas=265,265&optimize=medium&fit=bounds",
Venus Pearl,Safco Dental,BGEYT,Composite Fillings - Universal,https://www.safcodental.com/product/venus-pearl,$70.99,,In Stock,"Universal nano-hybrid composite indicated for all classes of anterior and&nbsp;posterior restorations, direct composite veneers, core build-up or&nbsp;porcelain repairs.
The innovative formula, based on the urethane monomer chemistry of Venus Diamond,&nbsp;possesses superior physical properties such as low shrinkage stress and high flexural strength.&nbsp;The creamy consistency allows for easy and convenient handling, excellent sculptability, and&nbsp;superb polishability. The wide range of shades provides excellent color adaptation through a&nbsp;single or multiple layer technique for beautiful, long-lasting, esthetic results.
Pure shades match anterior and posterior restorations effortlessly while simplifying the workflow.
&nbsp;",{},"https://www.safcodental.com/media/catalog/product/b/g/bgeyt.jpg?width=265&height=265&canvas=265,265&optimize=medium&fit=bounds",
